<?xml version="1.0" encoding="UTF-8"?>
<Review xmlns="http://www.tim12.com/review"
 xmlns:user="http://www.tim12.com/user"
 xmlns:jxb="http://java.sun.com/xml/ns/jaxb"
 xmlns:xsi="http://www.w3.org/2001/XMLSchema-instance"
 xsi:schemaLocation="http://www.tim12.com/review file:/D:/Faks/XML/Projekat/xml-papersapp/backend/src/main/resources/data/Review.xsd">
    <Authors>
    </Authors>
    <Reviewer>
        <firstName>firstName0</firstName>
        <lastName>lastName0</lastName>
        <email>0@00.AA</email>
    </Reviewer>
    <Comments>
        <Comment>Comment0</Comment>
        <Comment>Comment1</Comment>
    </Comments>
    <finalDecision>finalDecision0</finalDecision>
    <overallOpinion>overallOpinion0</overallOpinion>
</Review>
